{
  "version": 1,
  "acceptedAt": "2026-05-13T12:49:56.661Z",
  "corpus": [
    {
      "package": "@esbenwiberg/corpus-default",
      "version": "1.0.0"
    }
  ],
  "fitness": 93.55555555555556,
  "dimensions": {
    "context": 87.77777777777777,
    "consistency": 100,
    "cost": 80,
    "feedback": 100,
    "latency": null,
    "safety": 100
  },
  "probes": {
    "agent.guidance-nested": 60,
    "agent.guidance-present": 100,
    "agent.guidance-substance": 80,
    "arch.doc-present": 100,
    "changelog.strategy-declared": 100,
    "ci.configured": 100,
    "dead.code-configured": 100,
    "deps.audit-configured": 100,
    "deps.lockfile-present": 100,
    "docs.contributing-present": 100,
    "docs.readme-present": 100,
    "docs.readme-substance": 50,
    "editorconfig.present": 100,
    "format.configured": 100,
    "hooks.precommit-present": 100,
    "lint.configured": 100,
    "safety.dangerous-script-flags": 100,
    "secrets.dotenv-gitignored": 100,
    "tests.runner-configured": 100,
    "types.configured": 100,
    "arch.fitness-tests-configured": 100,
    "ci.runs-tests": 100,
    "docs.adr-presence": 0,
    "gitignore.comprehensive": 100,
    "hooks.gates-lint-test-build": 100,
    "secrets.precommit-scan-configured": 100,
    "size.directory-depth": 80,
    "size.large-files": 80,
    "size.repo-token-estimate": 80,
    "specs.present": 100,
    "commits.conventional-followed": 100
  },
  "commit": "ef70de36930fd08b0b9b3589f99b30d39a859252"
}
